title,selftext,author_flair_text,link_flair_text,score,upvote_ratio,distinguished,is_original_content,is_self,num_comments,subreddit
Sheldon’s character,"Everybody is constantly laughing off at Sheldon’s character. I don’t find that relatable. The guy makes total sense. If a person is to live a better life, it is important to care about small things. People make fun of him for having an enemies list, keeping track of his bowel movements, characterising his travel outfits according to weather occasion, having a weekly blast etc. but deep down it feels so soothing and fulfilling that someone is organised enough to maintain all that stuff. I personally look up to him and take ideas from his lifestyle to incorporate into mine.  

His opinions on gender blindness and stuff - I would love to see that in the real world. Im a girl and I’ve personally seen my other girl friends reject the option of engineering because of it being a male dominated field. 

I mean I get it, he has quirks and is often oblivious to social cues  - that’s because the people in the show are so used to mocking him or treating him wrong that they fail to help him improve. Amy deserves a round of applause for being that person who helped Sheldon improve his emotional intelligence.

Overall, I would love a group of friends like Sheldon’s - altering the interest in video games and Star Trek and changing it into robotics.


To conclude: I am gonna be an engineer and engineers are just as smart as physicists.


edit: why arent people commenting, is everyone on this subreddit dumb?",,Character discussion,0,0.48,,False,True,26,bigbangtheory
Sheldon might have a half brother in Vietnam,"Sheldon's father served in the Vietnam War. In s1 e2 of Young Sheldon, upon meeting Tam, George sr. says ""Is your mom named Kim Lee by any chance?"". George implied that he had sex with a woman while serving in Vietnam here, and was checking if Tam was his illegitimate son. So with this information, there is a chance that this woman with whom George had sex may have become pregnant. They probably didnt use contraception so the chance of her having gotten pregnant are quite high.

TLDR; George Sr. may have had an illegitimate son in Vietnam.",,Character discussion,104,0.93,,False,True,46,bigbangtheory
S3 ep8, When penny falls in the shower and breaks her arm What did Sheldon accidentally touch? Her boob or ass?,,Character discussion,12,0.8,,False,True,17,bigbangtheory
Weird observation,"In the first episode of season 12 raj mentions himself and Leonard went too see mamma Mia 2, which has the actor who plays Leonard’s mum in the show.",,Episode discussion,21,0.84,,False,True,15,bigbangtheory
Bernadette's character change,"I was seeing an earlier episode where Leonard is dating Priya and invites Howard and Berni for couples hang out. Amy suggests that Priya is trying to break her apart as she is the weakest of the group like a wildebeest. She then asks Berni to spy & Berni is all nervous as she cant lie and then panics when her story about Penny dating falls apart.

In the subsequent seasons she is shown as manipulative person who ppl are scared from and she spreads rumours about her colleagues to advance forward.

What happened here?!",,Character discussion,177,0.97,,False,True,73,bigbangtheory
Denise and Stuart,"I really liked Stuart's girlfriend Denise. I was happy he found someone. My fav moment is when she shot Raj with her paintball gun and screamed ""Ah! Sad Man!"" Is anyone else a fan? If not what kind of woman did you want him to be with?",,Character discussion,86,0.98,,False,True,33,bigbangtheory
"Honestly, Penny is sort of a wh$%÷... and She and Leonard should never be a couple. She barely respects him... Is that wrong of me to say? I watch this show, and it always pops out at me...",,,Character discussion,0,0.25,,False,True,50,bigbangtheory
We all know someone who wouldn´t agree with this,,,Other,27,0.89,,False,False,6,bigbangtheory
Fun fact,The girl rajesh’s father shows he’s dating in season 12 e2 is actually Kunal’s real wife.,,Cast news or sighting,27,0.97,,False,True,7,bigbangtheory
Best series start,"In my opinion that the first episode to the show couldn't have been any better. I know the show started off with a comedy focus, then morphed into a semi comedy/drama based show. 

Are there any episodes that you believe were ""perfect""?",,Episode discussion,1,1.0,,False,True,10,bigbangtheory
Started 4 days ago and i’m already on season 5 😭,"So my college semester just ended and during my finals, Young Sheldon was all over TikTok so I started Young Sheldon. 3 seasons into Young Sheldon I started looking up stuff about “Sheldon Cooper”😭😭😭 that’s when I found out Young Sheldon the show is a prequel to Big Bang Theory so I decided to watch the first episode and I’m not gonna lie it’s been a while I enjoyed a show this much and I’m starting to get sad I’m speeding through it. it’s so addicting and such an easy watch. This show is top 3 easily in Tv history every season just gets better and better wtf",,Relevant to me,53,0.94,,False,True,6,bigbangtheory
Mother of Sheldon was correct.,,,meme,935,0.97,,False,False,59,bigbangtheory
Who did Sheldon inherit his intelligence from?,Was it mom or dad?  I'm betting mom.,,Character discussion,1,0.56,,False,True,26,bigbangtheory
I happened to be thinking of TBBT as I was walking into a McDonald's. Look at what was playing on the TV.,,,Relevant to me,98,0.96,,False,False,11,bigbangtheory
Penny would not have been a successful pharmaceutical salesperson,"Pharmaceutical sales is incredibly difficult and possibly incredibly rewarding. However based on Penny’s character, I don’t think she would have been a good salesperson. She has an innate lack of responsibility that still shows even towards the end of the show. I really doubt she can manage professional relationships very well given Dr. Lorvis. If that ever happened in real life, she just lost her biggest client and any other doctors that knows him. She might have a degree of charm but it takes way more than that to make it in that incredibly cut throat field. I know someone will bring up that she is incredibly hard working from the Vegas trip and how she was pushing Bernadette’s meds but I am arguing she wouldn’t have gotten there in the first place.",,Character discussion,0,0.41,,False,True,4,bigbangtheory
Worst BBT Character,,,Character discussion,2,0.55,,False,True,81,bigbangtheory
Worst season?,It's very hard for me to pick. There are so many bad seasons in this show. But I would say 4 or 8.,,Episode discussion,1,0.53,,False,True,27,bigbangtheory
not sure if this has been discussed yet but …,"who’s side were you on in the argument between Howard and Raj when Raj cut Howard off because he blamed him for ruining his confidence.

I personally think Raj was being slack to Howard for blaming him for his life because he has a banter friendship. 
what does everyone else think ?",,Storyline discussion,0,0.5,,False,True,8,bigbangtheory
Another plot hole for convenience,"Anyone else notice that in season 2 when the guys go to Vegas to help Howard get over Leslie, Sheldon accidently locks himself out of the apartment because he leaves his keys in the bowl but there's never been any suggestion that the door locks itself when you leave? Reason being is that Penny constantly walks in and out without needing a key when they're home. I can't see a latch on the door or anything...

EDIT: for those pedantic people, I mean ""continuity error"" rather than plot hole. Please focus on the question asked if possible.",,Storyline discussion,1,0.53,,False,True,13,bigbangtheory
Sheldon’s Clothes,"I don’t know if it was explained later in young Sheldon cus I just started watching it, but is it weird to anybody else that Sheldon dressed like a grown man as a kid and then when he grew up dressed like a kid only ever really wearing comic book t-shirts. You would think since he wore dress shirts and bow ties as a kid when he grew into that he would continue wearing it. And on the flip side if he wore kids clothes as an adult it would be what he wore as a kid. Does anyone have any ideas as to why this is?",,Character discussion,2,0.6,,False,True,5,bigbangtheory
"I love that Wolowitz ""only"" has a Master's","I'm not as smart as any of these characters, but I appreciate that Wolowitz has a Master's and is just as smart as all of his doctor friends.

I got my Master's in Mental Health Counseling, but most of my friends went on to get their Ph.D.s. Despite the academic disparity, we all still talk about the same stuff we did when we were in grad school. None of them hold their degrees over me or anything like that.

It's nice to see this uneven dynamic represented on such a big show (even though his friends are often dicks about it 😂).",,Character discussion,179,0.97,,False,True,34,bigbangtheory
"If you could make a change in the last episode, what would you do?",I would like to see Stuart in the last scene,,Episode discussion,0,0.44,,False,True,17,bigbangtheory
Favorite side characters(s) from both series?,"Prof. Proton
Sheldon's rival in YS
Dr. Sturges (what isn't there to love about Wallace Shawn?)
Stewart's actual GF
Nowitski (aka Yoko Ono)",,Character discussion,6,1.0,,False,True,16,bigbangtheory
Big Bang Theory gets way funnier in Season 11 and Season 12,Big Bang Theory gets way funnier in Season 11 and Season 12,,Episode discussion,6,0.8,,False,True,1,bigbangtheory
What's your favorite episode of season 1?,"I’ve been binge-watching the show for the third time, and I can’t help but relish all the hilarious moments that made this series legendary. One episode that never fails to crack me is when Missy visits Sheldon. The sheer genius and absurdity had me in stitches.

Which episode from Season 1 is your absolute favorite?",,Video,5,1.0,,False,False,2,bigbangtheory
Which of the following would you like to see as another potential spinoff?,"*Raj's World*\- A show about Raj in his teen years, growing up in India, etc.

*ComicCenter-* A show focused on Stewart and Denise. Centered on the Comic book Store and the characters that frequent it (captain sweatpants, kareem-abdul jabbar).

*The Hofstaders-*  A show focused on Leonard and Penny as they move to Nebraska to be closer to Penny's family. We also get confirmation of Penny's Maiden name being Teller.

*Mr. and Mrs. Wolowicz-* A show focused on Howards Parents. We find out why Howards dad left, and what became of him. The first season is them together, subsequent seasons are focused on both of them, just in different places.

&#x200B;

[View Poll](https://www.reddit.com/poll/13w0fzj)",,Other,7,0.77,,False,True,29,bigbangtheory
Pennys change in clothes,Did y’all notice her change in dressing herself throughout the series ?,,Character discussion,3,0.67,,False,True,9,bigbangtheory
Favorite episode,"Please tell me your favorite episode. For me it’s The Long Distance Dissonance, because of the ending",,Episode discussion,6,0.8,,False,True,40,bigbangtheory
What if George St was in Big Bang Theory?,I had a thought today while watching “the VCR Illumination”- what if George didn’t die when Sheldon was a kid? What if he was apart of Sheldon’s life during the run of the Big Bang Theory? How would Sheldon be different if his father was there for him growing up?,,Storyline discussion,0,0.33,,False,True,1,bigbangtheory
Most heart-warming episode?,"The last one before the finale (I think) where Leonard and Beverly made up for real.  I kept waiting for the other shoe to drop as it has before but was delighted to see that it didn't.

Although, I think they should've at least had her give Sheldon and Amy a congratulatory call.

Hell, Professor Proton go a scene.",,Episode discussion,1,1.0,,False,True,5,bigbangtheory
She was fortunate.,,,meme,452,0.68,,False,False,331,bigbangtheory
"""Hang on. Are you feeling insecure? Because that's my thing, and if you take it away, I don't know what I'm bringing to this relationship.""",,,Video,163,0.96,,False,False,10,bigbangtheory
"Real Life Sheldon: Boy, 12, graduates from California college with five degrees",,,Other,112,0.93,,False,False,16,bigbangtheory
Any Farrah Fowler,Is it just me or is Amy actually a pretty bad friend? She jumped at the chance to play Bernie and Penny against each other. She gets mad when Penny tries to comfort Sheldon. There’s so much more.,,Character discussion,0,0.44,,False,True,19,bigbangtheory
Girl: “What is goth food” Raj: “Uh…blackened salmon?”😂💀,I laughed so hard at this scene,,Episode discussion,199,1.0,,False,False,8,bigbangtheory
I love penny and Sheldon’s friendship .,What’s your favorite friendship ?,,Character discussion,94,0.96,,False,True,16,bigbangtheory
Losing my interest,"Am I the only one that likes this series less and less with each watching... I used to be the hopeless romantic that cheered for Leonard when he and Penny were together and felt Leonads pain when she broke his heart. Now with each watching, I just get more angry at how Penny treats Leonard even after being married. And while on rare occasions they are shown as a loving couple, more often there is the angst that any moment Penny is going to leave Leonard for someone else and they continuously joke about it.  TBH in my opinion Penny and Leonard did have a more stable Loving relationship than the writers let us see.  But I am surprised that Howard didn't look at Bernie at one point and say I am done with this and left her because she turns into a mean woman. I don't know I just don't enjoy this show like I did when I first watched it on tv and maybe that has to do with the ability to binge-watch the episodes without having to wait week to week for a new episode.",,Relevant to me,7,0.62,,False,True,27,bigbangtheory
Did anyone else notice Sheldon makes a noise every time he is about to speak?,"I noticed this recently when listening to the show while i work.

Almost every time Sheldon is about to say something he goes ""Ye-"" or ""Mgah-"" before talking.

It is starting to take a toll on my enjoyment in the show!",,Relevant to me,0,0.17,,False,True,2,bigbangtheory
Fez vs Raj who would you rather hang out?,Personally I rather hang out with Raj because Fez is an annoying pervert.,,Other,5,0.65,,False,False,21,bigbangtheory
"S2 E7 - isn’t it odd that given Raj’s effeminate taste, he wasn’t aware of America’s Next Top Model? Didn’t he make a Tyra Banks reference down the track?",,,Episode discussion,73,0.92,,False,False,15,bigbangtheory
I need suggestions,"I just finished binging TBBT and absolutely loved it. Now, I would like suggestions for other comedies with great casts and wit. I'm thinking about The Office, Parks and Recreation, and How I Met Your Mother. Any thoughts about those or anything else. I have watched Schitts Creek and Kim's Convenience. I also want it to be around 30 minutes. Thanks.",,Other,5,0.78,,False,True,38,bigbangtheory
I just started watching the show...,"I was browsing through Max after the recent rebrand and The Big Bang Theory popped up, so I finally fired up the show after having people recommend it to me for years.

I ended up bingeing seasons 1-2 in a weekend. 😂 

I just saw the Season 3 episode where Sheldon keeps hiding or running away whenever an argument breaks out, and I found it so sad! I think this is the episode that finally made me see him as a person and not just a comedic device.

The writers did a good job keeping it light, but the moment he turned on the blender when Leonard and Penny started arguing, I knew what was happening and it just broke my heart! Poor Sheldon! 🥺",,Storyline discussion,61,0.97,,False,True,8,bigbangtheory
Now I understand why Sheldon was so afraid of geese.,,,meme,35,0.94,,False,False,7,bigbangtheory
Guys. I'm just going to say it.,"Zach is overrated. He was an asshole. Every time I see this guy in episodes I wonder, ""How many episodes does he have to appear in?"".

You may be wondering why he is an asshole.

He's stupid because of the things he did in college that made him infertile. He's irritating because he's appears in too enough episodes, it's also irritating how he and Penny were married. All this makes him contemptible.

All this is the definition of an asshole.",,Character discussion,0,0.1,,False,True,53,bigbangtheory
How do you feel about the final episode of Young Sheldon bringing them all back for a scene?,,,Young Sheldon,621,0.96,,False,False,116,bigbangtheory
Another rewatch done. Thoughts on the finale.,"I see a lot of people discuss the final episode and how it feels like good closure. The main criticism is Penny’s storyline. However I think Amy’s story line is really annoying. She’s so passionate about how female scientists should be celebrated for their brain and the writers just give her a huge makeover for the last episode. She’s one of only four women to win this and they decided to focus on her appearance, something that she is not unhappy with throughout the whole show?",,Episode discussion,5,0.67,,False,True,5,bigbangtheory
"Has anyone out there ever heard of someone making a real life ""Roommate Agreement""? Share your stories!",,,Character discussion,7,0.71,,False,True,3,bigbangtheory
Chatting with Kevin Sussman…,"Was a great experience chatting with the very warm and kind Kevin at Supanova Melbourne 2023.

Thought you all might like the pics.",,Cast news or sighting,27,0.97,,False,False,1,bigbangtheory
YS and TBBT Actors,It's so cool how the characters in YS look so much like their older selves in TBBT. So many shows and movies dont pay enough attention to this detail. I'm talking especially about Georgie and Missy. They look like they actually could be related just like the Marys are (ICYDK they're real life mother and daughter).,,Young Sheldon,12,0.78,,False,True,8,bigbangtheory
"""You might be from Texas but I'm from New Jersey"". Anyone remember this?","Anyone remember when Leonard says ""You might be from Texas but I'm from New Jersey""?

It just got me thinking...which states trump other states in this kind of comparison?

And also, which states do you think Sheldon would say trump other states? How would Sheldon Cooper rank them?",,Episode discussion,39,0.87,,False,True,23,bigbangtheory
Sheldon Says Chili is NOT chili if it has beans. Is he right or wrong?,,,Storyline discussion,312,0.95,,False,False,228,bigbangtheory
How would Sheldon react to the COVID-19 pandemic?,List your opinions and explanations.,,Character discussion,0,0.5,,False,True,8,bigbangtheory
What are your predictions for the new spin-off?,"Right now we don't know anything at all about it, but it doesn't mean we can't speculate a bit. What do you expect to see in the new show? Do you think we'll get another prequel like ""Young Sheldon""? Or maybe it'll be a sequel this time around? Will we see Sheldon playing an important role in the story yet again or will the producers try to create a show without him?",,Other,0,0.5,,False,True,22,bigbangtheory
Howard Astronaut conundrum,"If Bernadette had not backed down, should Howard have given up.the relationship to make his dream of going to space come true?",,Storyline discussion,24,0.88,,False,True,14,bigbangtheory
Big bang theory 10 years later,"Do you think that there should be a tbbt movie ten years after the series finale where it has all the main/iconic characters and there kids. It's stated that sheldon and Amy have kids, one named Leonard. I personally think it would be really cool to see this.


EDIT: Thanks for all the likes. I didn't expect this post to blow up so much.",,Storyline discussion,101,0.92,,False,True,66,bigbangtheory
Yes..I did..am I in trouble...😛,,,meme,18,0.77,,False,False,2,bigbangtheory
"Amy hummed the 2001: Space Odyssey theme song to Sheldon at bedtime one night, but does anyone remember the name of the other song she also hummed?","Got an ear worm that’s driving me nuts and happens to be this very song.  Know what it sounds like and can hum it myself but the name of it eludes me.  Looking online maybe the episode was “Veracity Elasticity” but not sure.  Know she did the Space Odyssey in bed trying to distract him.  Oddly specific request I know, but Reddit is my last hope.  TIA.",,Episode discussion,3,0.8,,False,True,16,bigbangtheory
What kind of lunatic goes to mcdonalds and gets fruit?,This is a serious question.,,Episode discussion,99,0.95,,False,True,25,bigbangtheory
Where do you watch tbbt,I'm not sure if anyone else had this issue but I watch tbbt on HBO since thier change to MAX it has removed it from my continue watching and the episode I'm on doesn't update and since I have watched ever episode they all show watch idk where I left off so it's annoying but it's not just tbbt it's everything idk I'm I the only one dealing with this,,Storyline discussion,14,0.78,,False,True,65,bigbangtheory
Nearly done watching TBBT for the 5th time now,"I may have a problem, I tried watching other Sitcoms after TBBT and it did work for how I met your mother. I watched HIMYM after Neil Patrick Harris got announced for Doctor Who and I´ve loved it. A few months later I tried watching HIMYM again because I just wanted to but I almost immediately switched to TBBT again instead... I´m german by the way, watched the show in german two times and in english the third time now.

And I´m willing to admit that I will watch that show a 6th time again.

By the way. I started watching TBBT in 2022 I think? or perhaps even near end 2021? I just needed something else to watch. I was in a kind of ""weird"" phase in my life and watching TBBT changed my Life pretty much completely. I felt very welcome to the show thanks to all of the references to other shows I watched and loved. It´s crazy how a show like this kind of evolved and formed me as a person...

Thank you for reading until the end :) It´s nice to write something like this knowing that 98.9k other Users love this show as much as I do",,Relevant to me,44,0.89,,False,True,32,bigbangtheory
"Nurse: Where’s the rest of the robot? Howard: I only built the arm. Nurse: ‘Cause that’s all you needed, right?",,,Storyline discussion,33,0.85,,False,False,1,bigbangtheory
Sheldon possibly ending up with someone else,"Sheldon only had a relationship with Amy. However, I would have loved it he tried dating with other women. Possibly this one he interacted with. I don't like Amy and would have like him to end up with someone else.",,Character discussion,111,0.84,,False,False,73,bigbangtheory
Pilot episode Juice Box,Just wondering if anyone knew if any special significance to Howard handing a juice box to Penny... was this just a prop sticker?,,Episode discussion,2,0.67,,False,False,1,bigbangtheory
Startling revelations. Amy seen Barry Kripke’s penis before Sheldon’s,,,Character discussion,7,0.76,,False,True,8,bigbangtheory
What all to watch before TBBT?,"I completed watching TBBT yesterday, and really enjoyed the show and the ending was wholesome. Now, there were many instances in the show where other web series/movie references were given but I've not watched many of them. Yeah, I'm the Penny of real life. So I was wondering if someone could suggest some of the most frequent shows that I should watch to enjoy the series more. 
I would watch them first and then rewatch the series sometime in the future. So it'll be great. 
I've not even watched Star Wars Trek which comes up in the show, like very often so you know where I stand.",,Storyline discussion,55,0.98,,False,True,53,bigbangtheory
Anyone else notice that UCLA educated Dr. Bialik holds her utensil’s like an ocean mermaid who doesn’t know what forks are?,,,Character discussion,0,0.16,,False,False,24,bigbangtheory
Penny’s short hair vs long,"Happy Friday BBT fans! Hope everyone is having a good week and day! 

Would love to know what everyone’s opinion is for Penny’s hair. Do you like it short or long. IMO, I liked it long, she looks so bad with short hair. (Again IMO- don’t hate me too much, LOL)

[View Poll](https://www.reddit.com/poll/13sqois)",,Character discussion,5,0.65,,False,True,20,bigbangtheory
So am I the only one who notices the change in how Bernadette speaks?,"I’m not talking about the pitch. We all know her voice gets higher after her first couple appearances.

In the last 4ish seasons, she almost talks like a baby at times. I think it started prior to the pregnancies but I could be wrong. She starts to pronounce words weird and develops a slight lisp, especially when she pronounces “sh” sounds. It drives me crazy. 

Did anybody else notice that?",,Character discussion,55,0.83,,False,True,18,bigbangtheory
"Based on what we've seen in Young Sheldon, who do you consider to be the best ""parental figure"" of the family?","

[View Poll](https://www.reddit.com/poll/13shjyy)",,Young Sheldon,2,0.59,,False,True,7,bigbangtheory
"For once, they could've shown Howard not being so miserable (S08 E03)",,,Episode discussion,389,0.97,,False,False,55,bigbangtheory
Fork or Trident?,,,Repost,33,0.92,,False,False,7,bigbangtheory
It was great while it lasted.....,,I'm worse than Howard,meme,186,0.91,,False,False,17,bigbangtheory
Sheldon possibly ending up with someone else,"Sheldon only had a relationship with Amy. However, I would have loved it he tried dating with other women. Possibly this one he interacted with. I don't like Amy and would have like him to end up with someone else.",,Character discussion,1,0.53,,False,False,3,bigbangtheory
Name the best trait and the worst trait of the main cast. Only one of each.,,,Character discussion,92,0.96,,False,False,35,bigbangtheory
Did the Russian paper not disprove super asymmetry?,"I know the win a Nobel at the end, but how do they retcon the Russian paper?",,Other,1,0.53,,False,True,3,bigbangtheory
