title,selftext,author_flair_text,link_flair_text,score,upvote_ratio,distinguished,is_original_content,is_self,num_comments,subreddit
A question I have for the Big Bang viewers,"This is for the people who seen TBBT before YS do you think that YS ruined TBBT in some way well not ruined but is inconsistent with TBBT. 

I watched young Sheldon before I watched the Big Bang Theory and I see a lot of plot holes because I know the Big Bang came out first but I just feel like if they were going to make a prequel to a show that’s in the “future” don’t you think the events would line up. I started watching the Big Bang theory and I enjoy it more than young Sheldon now when I watch young Sheldon I just hate that certain parts don’t match up with what was said in the Big Bang",,Storyline discussion,4,0.58,,False,True,26,bigbangtheory
Am I the only one who thinks the relationship between Raj and Isabella is one of the biggest missed opportunity of the show?,"I always thought it was a great subplot that could've made Raj more mature, I'm kinda upset the relationship didn't go anywhere and got rid of it with just a ""we broke up last week lol""",,Storyline discussion,616,0.95,,False,False,81,bigbangtheory
They got the description for S3 Ep3 wrong lol,,,Episode discussion,33,0.95,,False,False,7,bigbangtheory
"I always forget Howard had some game to hit this, his bar mitzvah bonds that is",,,Episode discussion,142,0.97,,False,False,20,bigbangtheory
Penny is mean,"Im going through a tough time in my life right now, so I re started BBT over again. I want to appreciate the value of friendship while I watch it all over. Now that I am older, I am sort of hating on Penny in the beginning seasons. She is so bitchy, rude and unreasonable. I know Sheldon is quirky and a bit out there, but she doesn’t appreciate his routine and regularity. She is also quite mean and rude to the others as well. Has anyone else felt like this with her ? I’m on season 2 right now and I am hoping my vibe about her will change as the group grows closer to one another but I just want to yell at the screen and tell her off right now.  Lol",,Character discussion,1,0.52,,False,True,34,bigbangtheory
'Big Bang Theory' announces new spin-off series,"The announcement was made during the Warner Bros Discovery press day recently, where the company also revealed its new platform Max, a rebranded combination of HBO Max and Discovery+.

Executive producer Chuck Lorre, who co-created the original Big Bang Theory series with Bill Prady, will be developing the new show for Max.",,Other,1,0.6,,False,False,7,bigbangtheory
Missing Sheldon? Watch Not Dead Yet.,"One of the main cast (Edward) is a lawyer and when he gets sick…omg he’s just like Sheldon. He even asks his roommate to rub Vicks on his chest. 

FWIW the rest of the show (while good) isn’t anything like TBBT.",,Other,0,0.5,,False,True,0,bigbangtheory
"Isn’t it a bit odd that in a show where the characters are huge fans of Lord of the Rings, Sean Austin, who plays Sam, appears as a character in the show..?",,,Character discussion,174,0.85,,False,False,50,bigbangtheory
Raj is sometimes a hypocrite,"Did anyone notice Raj scolds Leonard for referring to his sister as Brown Sugar and calls it defilement (s5e13),
but he himself called Mrs Davis at HR the same thing? (s6e12)",,Character discussion,10,0.69,,False,True,16,bigbangtheory
What Episode/Character is this referencing,"I have a Big Bang Theory Daily Calander, and I don't know what episode/character today is supposed to be.",,Episode discussion,6,1.0,,False,False,4,bigbangtheory
is it just me or is she a bad actor compared to the rest of the cast,,,Character discussion,434,0.9,,False,False,114,bigbangtheory
The Valentine's Vet,I wish they would have explored the Raj dating the vet after Cinnamon ate the chocolates. Possibly having a storyline where they get together after his relationship with Emily. Especially over the hotel worker they wrote in to the storyline.,,Storyline discussion,89,0.95,,False,False,25,bigbangtheory
Would Sheldon have turned out smarter and achieved bigger things if he had Leonard Mum,I feel like Sheldon probably would have turned out smarter and achieved bigger things having a mum like Leonard had who would have understood him better and challenged him more,,Character discussion,2,0.57,,False,True,12,bigbangtheory
S4E21 the Agreement Dissection,"This dialogue;
“Leonard, you hate Greek food.”
“Not as much as you.”

Did Leonard mean not as much as Sheldon hates Greek food or not as much as he hates Sheldon?",,Character discussion,0,0.44,,False,True,18,bigbangtheory
"you people who play one-on-one. What’s wrong with you… playing one-on-one. .. are you sick or just weird, why would you even play one-on-one",,,Episode discussion,9,0.72,,False,False,2,bigbangtheory
In one episode Will Wheaton asked Stuard what is wrong with Sheldon and Stuard said everybody has their own theory. What is your theory?,I think he might have some autism and Grapheme-color synesthesia (as seen in the episode where he found a small planet when he helped out Raj).. On top of just seeming weird because he is so intelligent 😅,,Character discussion,3,0.64,,False,True,14,bigbangtheory
MA implies arts right? Which arts subject would Sheldon's MA have been in?,The title,,Character discussion,260,0.98,,False,False,68,bigbangtheory
Finished tbbt today. Am very glad about the ending. But now idk ehat to watch while having lunch 😭,,,Other,71,0.94,,False,True,70,bigbangtheory
Which character changed the most throughout the show?,For me it’s Amy. Watch her in season 4 and then watch her in the final 3 seasons and it’s a completely different person,,Character discussion,3,0.64,,False,True,10,bigbangtheory
"TBBT Should Have Spent More Time At Sheldon's ""Cowboy Bar"". Agree or Disagree?",,,Other,124,0.94,,False,False,14,bigbangtheory
Saddest BBT moment GO!,,,Episode discussion,15,0.89,,False,True,38,bigbangtheory
Penny,"Anyone ever notice that Penny always looks at the camera? Especially in early seasons, I swear I see her look like 3 times per episode😂",,Character discussion,7,0.77,,False,True,14,bigbangtheory
Kaley trying not to laugh,"I swear there are times, especially jokes between Leonard and Penny, where Kaley is trying to surpress a laugh. It's like they've done several takes and she keeps laughing and now she's trying to hold it in.

I first noticed it in season 2 The Bath Item Gift Hypothesis, when they're sitting on her couch together and (I think) he says ""My leg's killing me thanks for asking."" She just smiles and leans into him and it looks like she's trying not to laugh.

Maybe I'm reading too much into these little moments. Has anyone else noticed it?",,Character discussion,10,0.82,,False,True,12,bigbangtheory
"This is random but it's really bugging me that all of Sheldon's ""whiteboards"" are super yellow. I have never seen a yellow whiteboard before.",,My mother had me tested.,Other,117,0.85,,False,False,60,bigbangtheory
When do you think CBS will stop playing Big Bang Theory everyday?,Idk about your CBS but my local TV station has been playing BBT after the national news for over a decade now. I know most people watch it on HBO Max but I usually catch a tail bit of it after the news (or admittedly sometimes watch the whole hour block),,Other,1,0.57,,False,True,9,bigbangtheory
is the big bang still occurring in this day since there is no time in space?,"since time does not exist in space doesnt that mean there is no end to the big bang and its still going on

from the big bang itself to the space expanding

its not like a youtube video that is 20 minutes long you play it and it goes from 1 minute to 20 minutes

since space does not exist the big bang from the beginning to now is still the big bang itself",,Other,0,0.5,,False,True,3,bigbangtheory
What item from the show would you keep as memorabilia?,I really like the Rubik’s cube tissue box,,Spoiler,37,0.96,,False,True,70,bigbangtheory
Anyone else find the jokes about Raj racist?,"Seriously, there are waaaaaaaaaaaay too many jokes about his skin color. ""I'm not dark chocolate! I'm melt-in-your-mouth caramel!"" and the way they're constantly calling him brown... combined with all the Indian stereotypes, it just makes me feel uncomfortable.",,Character discussion,0,0.28,,False,True,11,bigbangtheory
Takeaways?,"I am not from the US, so was wondering if its really that normal, culturally, to eat takeaways at the rate these guys have it? The only time they actually cook is when there is a ""formal party"", or, when Bernadette is pregnant ( in which case it would actually be helpful to order a takeaway)",,Relevant to me,17,0.96,,False,True,13,bigbangtheory
"S11 E21, The Comet Polarization","Who do you think discovered the Comet, Penny or Raj?",,Storyline discussion,0,0.5,,False,True,3,bigbangtheory
Spin-off possibilities,"I have two possible theories for what the spin-offs may be but I feel neither would work.

My first was Young Leonard, Howard or Raj but I feel like Leonard’s childhood was too dark for a comedy, Howard’s would have too little material and Raj’s was too boring.

The second was the gang raising their kids but it says a whole new cast, and it wouldn’t be the same with new cast members. Characters like Sheldon may also be seen as overused.

What do you guys think the spin off will be, or want the spin off to be?",,Other,1,0.99,,False,True,15,bigbangtheory
Theory on how Leonard got penny.,Everyone thinks it’s because he wore her down but what if he actually took Beverly’s advice and found out which cologne her dad wears😂,,Character discussion,1,0.6,,False,True,2,bigbangtheory
Where to watch,I'm just a new fan of the big bang theory and I wanna know where can I watch the whole series for free as a broke college student thanks!,,Other,5,1.0,,False,True,15,bigbangtheory
Instruction manual from Howard.,,,Other,17,0.92,,False,False,2,bigbangtheory
What is the cringiest moment?,,,Other,22,0.79,,False,True,78,bigbangtheory
Newbie,"I’m new here. I love the show but I have never seen it in its entirety. I’ve only seen episodes here and there. My boyfriend is the same but he loves the show too. We send big bang videos to each other to make each other laugh on bad days. Wellllll I finally treated myself to the complete series yesterday and I’m starting my journey tonight 💜💜💜. 

I can’t wait to see it all and be able to join in on all the discussions here.",,Other,18,0.87,,False,True,8,bigbangtheory
I think penny was being petty about the comet it's Rajesh job and he would have seen the comet without her anyway,,,Episode discussion,229,0.78,,False,False,103,bigbangtheory
Just Imagine Sheldon’s Rage,"I’m just rewatching The Mandalorian and Brian Posehn is in the first episode and it got me thinking in the BBT universe Bert may have made friends with Mark Hamil at Sheldon and Amy’s wedding, made some connections through the years, and then maybe brought his way into the role? And then I start laughing and thinking about how angry/jealous Sheldon would be

As on that topic do you think the BBT Characters would like the show? Or any of the new ones?",,Other,5,0.67,,False,True,1,bigbangtheory
"So, apparently the gang was really in Angel Stadium with Howard making the pitch using the mars rover prototype. Disclaimer: Im not an American and I don't watch baseball so I didn't know about this. At first I thought it was CGI or video edit.",,,Episode discussion,33,0.94,,False,False,8,bigbangtheory
Sheldon's sarcasm,"has anyone else noticed Sheldon's sarcasm and snark in the first episode? given the sarcasm sign, I think they should have toned it down",,Episode discussion,22,0.87,,False,True,5,bigbangtheory
How valid is the science?,How valid is the science behind the quantum gyroscope and the theory of super asymmetry?,,Storyline discussion,17,0.84,,False,True,4,bigbangtheory
Just Scrolling The Armageddon Expo Guest List When...,,,Cast news or sighting,50,1.0,,False,False,4,bigbangtheory
the one thing that annoys me about this show is how they poke the food but never eat lol,,,Episode discussion,493,0.93,,False,False,127,bigbangtheory
Who were all the celebrities that appeared as themselves (or fictionalized versions of themselves like Wil Wheaton did) in the series?,Not actors playing a character like Kathy Bates playing Mrs. Fowler or Billy Bob Thorton playing Dr. Oliver Lorvis.,,Character discussion,32,0.9,,False,True,45,bigbangtheory
One which episode was every single charakter of the main cast most anoying?,,,Character discussion,1,0.56,,False,True,2,bigbangtheory
OK but how cool would it have been to see Amy perform harp with the LA Philharmonic?,"I'm a bit of a classical music nerd so I was secretly hoping for that option.
Edit: IK it's fictional but it could have been nice",f♯ f♯ ee d♯ e e,Character discussion,32,0.91,,False,True,5,bigbangtheory
Emily or Cinnamon,"In “The Anxiety Optimization”
When the gang is playing “Emily or Cinnamon”, Howard says “how can such a little girl eat such a big steak”.

Who do you think Raj was talking to?",,Episode discussion,18,0.91,,False,True,5,bigbangtheory
"Imagine if Leonard wrote a book about his mother? She didn't deserve an apology arc, she deserved a humiliation arc.",,,Character discussion,329,0.96,,False,False,21,bigbangtheory
S07E09: The Thanks Giving Decoupling: One of my all time favorites.,,,Episode discussion,316,0.99,,False,False,25,bigbangtheory
Who do you think Raj should’ve ended up with ?,,,Character discussion,7,0.67,,False,True,48,bigbangtheory
What is Season 0?,Hello all. I am going through my first watch through of this funny show and I subscribed to HBO Max on Amazon Prime and I see that there is a Season 0. Some seem like specials so I have to ask. When should I watch them? And if I am wrong then what is Season 0?,,Other,3,0.64,,False,True,6,bigbangtheory
How is it that Sheldon is both intelligent and at the same time a total idiot?,,,Character discussion,60,0.8,,False,True,60,bigbangtheory
Why doesn't Howard carry an Epi Pen?,Seriously he knows he has a peanut allergy. An EpiPen would be good for emergencies rather than having to go to the hospital.,,Character discussion,17,0.78,,False,True,23,bigbangtheory
Bert was in FRIENDS,He is the guy who brings the script for Joey when he was on DOL.,,Cast news or sighting,60,0.9,,False,True,41,bigbangtheory
sheldon going down stairs naming stars..,"Without saying ""because he's quirky"" was there an actual reason Sheldon would try to match the syllables to each step he took? 

Those are the stars that are nearest to me

Tra la la and fiddle dee dee",,Character discussion,13,0.89,,False,True,11,bigbangtheory
"Who do you consider to be the ""Sheldon Whisperer?""","I'd say Penny with Amy a close second in the later seasons and Leonard, if anybody, in the early ones.",,Character discussion,12,0.93,,False,True,21,bigbangtheory
Somebody please explain the supercooled liquid thing?,I'm not a quantum physicist. But it's a major subplot through season 9.,,Storyline discussion,5,0.86,,False,True,7,bigbangtheory
"It seems that Penny and Bernadette are arguing very upset, what do you think is the reason?",Fight,,Character discussion,60,0.83,,False,False,16,bigbangtheory
Raj a typical Indian boy,"I love Raj and His Character development on the show. From season 1 to 5 the way his character progressed was something to watch. He is sweet but a hypocrite. He is shy but proud.  He loves America but dislike his own country. He loves beef and still respects his Religion. He loves women yet he is all hypocrite when it comes to his sister , Priya. All of his dialogue and his  conversations with Howard about racism and women are apt.

After season 5 his character became too imaginative. He became a loner and desperate for love. I mean if you have a degree from Cambridge and come from a rich Indian family. You will either be spoilt or too humble for this world. Raj is a spoilt child. It is too unusual to have a character development like this and its disappointing. There could have been so many darker jokes made out of his character. I don't know why they had to make him such a cutiepie and sad while the rest of them were settling in their life . The truth is a Indian guy would be married off first and already be having two kids. 

Maybe it is related with the wishes of the fans and they did not want to disappoint them with same cliche. I wish there could have been more.",,Character discussion,21,0.84,,False,True,14,bigbangtheory
Walowitz,I was watching old school and who do I see? Howard walowitz staring back at me! He was one of the pledges. How cool!,,Character discussion,2,0.62,,False,True,1,bigbangtheory
Big Bang Meemaw or Young Sheldon Meemaw?,"I prefer Young Sheldon Meemaw, she's hilarious.",,Character discussion,132,0.94,,False,True,61,bigbangtheory
Who is your worst celebrity cameo on the show?,,,Character discussion,1,0.6,,False,True,22,bigbangtheory
Big Bang Theory x Jeopardy,"If the characters of this show were in a Jeopardy tournament, which character would win?",,Other,14,0.9,,False,True,13,bigbangtheory
Anyone have an quotes or anything they picked up from the show that they use in their daily life?,For example: When Penny tells Amy’s dad he has to leave their apartment she says “Be quick about it” through her teeth. I now say it exactly how she said it when I let my dogs out to go potty lol,,Other,86,0.98,,False,True,178,bigbangtheory
Do your think there is an ex girlfriend from raj which shoulf be all the time in the show? And also be Rajs girlfriend all the time,,,Character discussion,1,0.56,,False,True,6,bigbangtheory
Wouldn't Sheldon's obsessive nature have made him get the lift fixed by writing numerous complaints or raising issues sometime in the 10 years ?,,,Character discussion,171,0.96,,False,True,36,bigbangtheory
I feel like people have been giving a free pass to Sheldon just because he doesn't do any of the things he does intentionally.,"But neither do most characters on the show. No one's as huge an ahole as Sheldon yet others are really hated here while Sheldon is not. It's like he does these things so much that people have pretty much started filtering them entirely.

Edit - By people I meant the audiences.",,Character discussion,5,0.58,,False,True,22,bigbangtheory
Anu,Why does everyone hate Anu? I actually don’t mind her,,Character discussion,19,0.74,,False,True,33,bigbangtheory
Why does Sheldon try to replace Professor Proton with Bill Nye the Science Guy in Season 7? Doesn’t he realize he’s only an engineer?,"Not only that, he only has a bachelor’s degree, making him lower than Howard.  Oompa Loompas of Science indeed.",,Storyline discussion,11,0.76,,False,True,5,bigbangtheory
Amy's name,Is Farrah Amy's middle name or does she have a hyphenated last name,,Character discussion,9,0.81,,False,True,10,bigbangtheory
"Ok, anyone see Howard on poker face? He's an FBI agent.",,,Cast news or sighting,4,0.83,,False,True,3,bigbangtheory
The Scavenger Hunt Episode is just so great,"I've always loved the big bang theory since watching reruns on TV like 10 years ago as a teenager with limited access to entertainment. 

A couple years back I watched the whole thing through to the end and did enjoy it, but agreed that there was a noticeable dip in quality in the later seasons. I started rewatching a few weeks ago, but as the seasons have gone on I've increasingly just been half watching while doing other stuff. It's a nice comforting background show that didn't demand my full attention. 

The scavenger hunt episode, though, made me sit up and take notice. I was glued to the screen throughout the episode and there was just so much I liked about it. 

The Big Bang theory back in season 1 started with such a simple premise that was inevitably starting to wear thin after multiple seasons since the show was more successful than anybody probably expected. Therefore, it made sense to have more of an ensemble cast and give the show more longevity by building up the different dynamics between characters and allowing them to play off of each other. 

The scavenger hunt does this is an interesting way by creating pairs that aren't usually seen interacting one on one (except Sheldon and Penny but I'll get to that). The pairs work great together and the episode as a whole is just a delight in the way it deviates from the normal structure of mainly group scenes talking with everyone being reasonably relaxed, to a more fast paced and competitive setting where you get a lot of one on one interactions outside of the usual Leonard/Sheldon, Leonard/Penny, Howard/Raj, and Howard/Bernadette, which are really the main common 1 on 1 dynamics seen in the show. 

Pair 1: Penny and Sheldon

Now Penny and Sheldon were the least exciting pair for me because they are seen interacting relatively regularly, and seeing them talk or be at odds or tension with each other isn't new. Still, though, it's a pleasant pairing, as even though Sheldon/Penny isn't a novel prospect like the others, it is a winning combination in my view, and having read this subreddit, it seems a lot of others agree with my opinion that they're good together. Through sheer familiarity the two are very comfortable with each other despite being probably the two most different characters on the show. Sheldon is probably one of the only men Penny has interacted with as an adult who isn't remotely interested in her romantically, and this is a double-edged sword for her as it means he won't make unwanted advances on her, which means she is more comfortable. However, he also won't pull punches with her and will call her out on things (her messy apartment, her check engine light, etc.) That a lot of guys wouldn't, because they're worried about offending her and ruining their chances with her. After years in each other's companies the two are both well aware of each other's idiosyncrasies and flaws, and have long since come to terms with them. They have a nice thing going on where Penny helps Sheldon with social skills and processing emotion, while Sheldon helps her improve her general knowledge and be better informed about the world. In a lot of ways, how well they worked together in the scavenger hunt was emblematic of how beautifully two people you'd think would never get on have grown together. Penny respects Sheldon's problem-solving skills and the two generally encourage each other, despite the bickering over things like the bowling ball that are inevitable between two people who are so close. Their scenes were fun, but nothing overly revolutionary compared to what the rest of the show had already built between them. 

Pair 2: Howard and Amy 

Howard and Amy are two characters that essentially have nothing to do with each other, and this is made clear by their initial awkwardness in the car together. However, it was great seeing them bond over Neil Diamond as they both do have a similar goofy/childlike nature when their guard is down, and both are used to having unusual interests that others don't find accessible, so their mutual bliss at having something in common to bond over is really beautiful. As funny as the Neil Diamond obsession was, though, I do wish that they had used it to further develop a more meaningful friendship between Howard and Amy, rather than just extending that one joke for the whole episode and calling it a day, it's one of my few gripes with this episode. 

Pair 3: Leonard and Bernadette

Leonard and Bernadette were by far my favourite pair of the video. Bernadette is well and truly a main character at this point and it is strange that we as the audience know almost nothing about her relationship with Leonard. I have mixed feelings about Bernadette's mean quips usually, some are hilarious and some are a bit meh, but I love her this episode and it was definitely my favourite pairing comedy-wise. When she's criticising Leonards driving while talking about how he didn't get put on a team with Penny and goes ""I'm starting to think she dodged a bullet... the slowest bullet it the world"" I had a good laugh. It was all in the delivery and I felt her heckling of Leonard was funny without crossing the line into excessive meanness. It would have been nice to see the two reconcile and bond a little more, but I suppose it at least gives insight into why the two don't interact more regularly. 

Overall, it was a fantastic episode and really reinvigorated my spirit in watching the latter half of the series.",,Episode discussion,60,0.98,,False,True,14,bigbangtheory
Penny was actually “close enough “ when she described Stephan hawking,It was Stephan hawking who first said that time started with the Big Bang,,Spoiler,28,0.95,,False,False,6,bigbangtheory
Bernadette,Am I the only one that absolutely adores bernadette. I think she’s on of the funnier characters. I also think that the people who don’t like her are just taking this show way too serious,,Character discussion,218,0.88,,False,True,79,bigbangtheory
Character you wished we got to see more of?,"Personally, it was Leslie.",,Character discussion,25,0.93,,False,True,53,bigbangtheory
Underrated but President Siebert is my favourite character,He's got quips for days,,Character discussion,79,0.95,,False,True,30,bigbangtheory
Funniest guest star?,"Personally I think kripke, who’s yours?",,Character discussion,27,0.9,,False,True,79,bigbangtheory
"Same, tbh",,,meme,393,0.99,,False,False,9,bigbangtheory
Did anyone else catch that Amy's mom was played by someone else in the video message when Sheldon and Amy told her they were having coitus every night than Cathy Bates?,,,Character discussion,36,0.69,,False,True,35,bigbangtheory
