title,selftext,author_flair_text,link_flair_text,score,upvote_ratio,distinguished,is_original_content,is_self,num_comments,subreddit
"I’m sorry, how can people NOT like the series finale?","I thought it was one of the most perfect endings to a sitcom, and very fitting to the narrative of the entire series. I thought they stuck to what the show was and there were no surprise ass-pulls or anything out of character, it was the ending that was completely necessary. 

It also helped with the last two episodes leading to it, I loved the episode with Leonard’s mom, that was also a good ending to that saga, and then the next episode with everything leading to the finale, it was also excellent that they fixed the elevator hahah. 

There are people out there that thought the ending was lame, but I think for a show that has many ups and downs, it was a great ending.",,Storyline discussion,138,0.91,,False,True,78,bigbangtheory
Actor for Sheldons Dad,"In a parallel universe its was sheldons mom not dad who died when he was young. 

Who would you like to have seen play Sheldons older Dad.",,Character discussion,12,0.88,,False,True,12,bigbangtheory
This has probably been pointed out but but I saw lauren lapkus (Denise) in Jurassic World,,,Cast news or sighting,29,0.84,,False,False,6,bigbangtheory
Bert on Everybody Loves Raymond in 1997,,,Relevant to me,16,0.86,,False,False,9,bigbangtheory
Amelia and the time traveller,"I would read that. 

And astronaut screams for 9 minutes.

And maybe a video of penny tipping a cow if they recorded that.",,Episode discussion,19,0.95,,False,True,21,bigbangtheory
A Tale of 2 Mothers,"Always wondered what an encounter between Beverly Hoffstedter and the mom from ""Two and a half men"" would be like. Would they get along? Would their personalities clash? They are so incredibly similar. An encounter would be quite interesting",,Character discussion,1,0.56,,False,True,2,bigbangtheory
Sheldon's a dad?,"I'm watching the newest episode of Young Sheldon and narrator Sheldon had a throw away line about having kids, has this ever been brought up before? I've been an avid fan for years and I swear I've never heard anything about him having kids",,Character discussion,6,0.75,,False,True,20,bigbangtheory
Published Articles with Mistakes,"This has been bothering me ever since. Why is Sheldon's paper about the super heavy element got published while there's a mistake in the first place? Aren't articles peer reviewed before being published? Not just Sheldon's paper, they also mentioned Leonard's multiplication error in his paper which apparently was published that's why he is very embarassed.",,Storyline discussion,0,0.5,,False,True,10,bigbangtheory
Raj and Anu meeting in Europe would have been a perfect finales for Raj,I think running into an ex lover would have been the perfect romantic ending for Raj. They could have done and accidental meeting before the Nobel ceremony and they discovery they still have feeling for each other and leave it has a open ending for Raj,,Storyline discussion,59,0.82,,False,True,31,bigbangtheory
Latest Young Sheldon Episode S6e19 Do you think Sheldon's father will pass away soon?,I watched the interactions and references to the family in TBBT... Its a shame that George Sr will die... But i didnt think it would be this soon... What fo you think will happen?,,Storyline discussion,0,0.5,,False,True,11,bigbangtheory
Big Bang theory or Young sheldon,I don't know if i should start whit Big Bang theory or Young sheldon. Which should i start whit ?,,Other,4,0.7,,False,True,10,bigbangtheory
The moving finger writes......,"....and having writ, moves on.

What are some other literary quotes that Sheldon uses?",,Character discussion,72,0.97,,False,True,32,bigbangtheory
This moment between Zack and Penny always makes me laugh so hard.,,,meme,299,0.97,,False,False,17,bigbangtheory
Leonard and Alice would be so happy together right now,,,Episode discussion,1,0.55,,False,True,7,bigbangtheory
"Sheldon's secret ""loyalty test""",I think it's hilarious that Leonard sees right through Sheldon's ruse.,,Episode discussion,11,0.93,,False,True,1,bigbangtheory
Sheldon's Game,"Season 6 episode 2 Sheldon presents a picture of the Solvay Conference with a few achronisms. Sheldon pointed out the Madame Curie one. What are the others? Here are the ones I found:
- One of the scientists is wearing a dunce hat.
- There's a laptop on the table.

Can anyone spot any other inconsistencies?
-",,Storyline discussion,3,1.0,,False,True,4,bigbangtheory
Question about S3 E10,"In ""The Gorilla Experiment"" do you think Penny was aware that she was actually putting down Leonard's research at the end of the episode? I know she was trying to seem like she understood his work but what she said was actually kind of demeaning.
Or was she simply regurgitating what Sheldon taught her?",,Episode discussion,14,0.9,,False,True,12,bigbangtheory
What season was his best look,,,Character discussion,394,0.97,,False,False,97,bigbangtheory
Question for Americans,"I was actually wondering what impact does the show have in the USA because in France it's just an average afternoon tv show REALLY not that popular ! can you tell me on a scale of sitcom popularity with Friends being at the top where would tbbt be ?  i was actually shocked when i found out that the actor who plays Sheldon has won an Emmy and that the actress who plays Penny has a star on Hollywood walk of fame .

If you are interested the most famous sitcoms in France (right after friends) are My wife&kids and Malcolm !",,Relevant to me,9,0.76,,False,True,26,bigbangtheory
So is Farah Amy's middle name or part of her last name?,,,Character discussion,1,0.54,,False,True,15,bigbangtheory
"i really tried to like it, but i don’t like the finale","it just feels like a downer. the whole episode is just ragging on sheldon, till the last part with his speech, which is just him apologizing. 

yes, sheldon has his problems, but being a bit self-absorbed on the biggest day of your life is hardly the worst thing anyones done on the show. 

and if he deserves all the ridicule bc he’s ‘always selfish’, it feels equally undeserved, bc the other characters are always mean to him. 

its not like he chooses to have all these rituals and obsessions — he’s said that life is extremely stressful for him, and that controlling everything helps him cope (like in the itchy sweater episode). yet everyone still takes every chance they get to mess with him, or make fun of him. like, come on.

he has flaws obviously, personal struggles don’t justify being jerk. but having the whole finale dedicated to “sheldon’s so selfish” still doesn’t feel justified. 

it’s just so un-uplifting. i love a good cheesy happy finale, not hating on a guy who can hardly help it.",,Episode discussion,3,0.55,,False,True,8,bigbangtheory
does anyone know any online dnd games?,,,Other,2,0.75,,False,True,3,bigbangtheory
"Despite being unlocked by some of the fandom, the later seasons showed great character growth.","Especially with Sheldon. He was still a PITA but at least with Amy we finally began to understand the reasons he does at least some of the stuff.

in fact the whole gang ""grew up"" as the series progressed.",,Character discussion,32,0.87,,False,True,15,bigbangtheory
Beverly did not deserve Leonards forgiveness,"Im watching the episode where Leonard forgives his mum but she really doesn't deserve it! I know the way she is is just who she is but she is a cold emotionless robot and she will never give Leonard the emotional closure he desperately craves! 

I kinda wish Leonard gave her the cold shoulder! He is messed up on so many levels because of her and he really deserves better than her! She is a horrible person and only sees her son as an experiment to propell her career ! Its really quite sad! I just wish she got her just desserts!",,Character discussion,205,0.94,,False,True,43,bigbangtheory
What the heck is going on in this picture?,,,Character discussion,273,0.94,,False,False,48,bigbangtheory
Which two characters in the main group disliked each other the most?,I feel like it's Amy and Bernadette. They try and rectify this in the later seasons particularly in season 11 where Amy has a lot of 1 on 1 scenes with Bernadette all of a sudden.  I don't think it paid off though.,,Character discussion,9,0.72,,False,True,28,bigbangtheory
The only logical spin off is Raj,"I'm not saying the show needs one. We've got Young Sheldon. But, in my opinion, a spin off needs to be for someone whose character can develop. I feel like all the other main characters concluded their stories nicely in BBT and any spinoff would just be another BBT. 

Frasier is a prime example of this. His story had much more to give after Cheers and Frasier was a completely different show but just as successful.

With good writers, I think a new story for Raj could be created. He'd have to move to avoid the other characters. Maybe New York or even Hawaii for his astronomy career?",,Storyline discussion,119,0.82,,False,False,50,bigbangtheory
Voodoo is real. You don't want to mess with voodoo.,"First of all Leonard was a jerk for mocking Penny's beliefs. Secondly, the voodoo comment is actually one of the smartest things that Penny ever said. 
Do you think Penny was more spiritual than Leonard?",,Character discussion,0,0.33,,False,True,17,bigbangtheory
Need a GIF,Could someone please make a GIF of the moment!?!  S8E15 about 13mins in.,,meme,0,0.33,,False,True,3,bigbangtheory
Ok maybe there's one other spin off that could potentially work. Would you watch this? The Big Bang Theory Presents: Leonard and Penny,,,Storyline discussion,244,0.85,,False,False,112,bigbangtheory
"Fellow Bangers, Who is YOUR favorite Batman?","I gotta know what this community thinks. I only included live action. I left out Cluny too.

[View Poll](https://www.reddit.com/poll/13a9r3s)",,Relevant to me,0,0.5,,False,True,16,bigbangtheory
Sheldon Cooper,,,Storyline discussion,147,0.94,,False,False,8,bigbangtheory
Bernadette states her ability to handle difficult children (like Sheldon) comes from her experience working in her mother's illegal daycare operation. With her dad being a career police officer I can see where Bernie gets her set of values.,,,Character discussion,76,0.9,,False,False,34,bigbangtheory
Hypocrisy,,,Character discussion,195,0.98,,False,False,18,bigbangtheory
"What Thief Would Sneak Into a locked building , go up three levels due to a broken elevator, break into an apartment and rob them? Was it from someone they knew? EP: ""The Bozeman Reaction""",,,Episode discussion,229,0.98,,False,False,78,bigbangtheory
The spin off that makes the most sense and wouldn't feel forced,,,Storyline discussion,495,0.92,,False,False,64,bigbangtheory
New spinoff idea!,"So, while watching “Young Sheldon” there was an episode where Sheldon’s mother m and dad were talking in bed. Sheldon had said something like “That’s not fair!” and his dad was saying that one day Sheldon would have kids and they would say the same thing to him.

Older Sheldon in his voiceover says “Jokes on him because I did have kids and they say it all the time!” (Sorry if it’s not the exact dialogue)

I was thinking a Sheldon/Amy spin-off with kids would be great. They could have the genius daughter/son and another boy like Sheldon’s brother that Sheldon would have to play catch with, throw a football around and volunteer/volunteered to be a coach.",,Young Sheldon,3,0.67,,False,True,20,bigbangtheory
Why did Penny keep her apartment?,"I know at one point, Leonard and Penny agreed that they would only live together a few times a week to appease Sheldon. But as time went on, they appeared to live together with Sheldon full time, yet she still kept her apartment (she is shown to still have girls night there still). Then it was still available for Sheldon and Amy to move in to conduct the cohabitation experiment when Amy’s apartment was being renovated. Obviously it’s a show and that’s what the writers chose, but I just think it’s so unrealistic. So was she still living there occasionally? Because it didn’t seem like it (so many jokes about living with Sheldon and seeing Penny and Leonard together in Leonard’s room) though I could definitely be wrong.",,Storyline discussion,26,0.87,,False,True,18,bigbangtheory
Finale,I just cried like a fucking baby. I've teared up a few times along the way but holy shit Sheldon's final speech hit so fucking hard.,,Episode discussion,55,0.92,,False,True,23,bigbangtheory
Sheldon interrupted speech in the app development episode,"In the season 4 episode where they try to develop the app for solving differential equations (Project Noodles), Sheldon gives a speech that goes something like this...

When in the course of human events, it becomes necessary to sever bonds

Or something to that effect...

Were they referencing some famous speech there?",,Storyline discussion,0,0.5,,False,True,2,bigbangtheory
What's the most uncomfortable joke for you?,"For me it's when Mary Cooper comes to visit and the gang (minus a jealous Sheldon) take her around town and correct her politically incorrect statements. At one point they wind up in a presumably Catholic church. There Howard makes two statements that I HATE:

The first occurs when Raj points out the crucifix to Howard who says ""That's the last Jew who tried to do situps."" As a Christian, I felt that remark was incredibly disrespectful to both religions.

The next is when Mary is asking everyone to pray. She comes to Howard who declines saying ""I'm just trying not to hurt into flames here.""",,Storyline discussion,0,0.26,,False,True,19,bigbangtheory
Where was the unaired pilot publicly released?,"I’ve seen the version that someone uploaded to YouTube (that one upload that was split into parts), but where did they originally get it? Was it a bonus feature on one of the DVD releases?",,Other,2,0.75,,False,True,8,bigbangtheory
Sheldon a wise man S8 episode 21,"I do not think I would have ever adjusted with Sheldon's personality because of his rudeness and him being completely ""know it all"" person.

BUT I just love his intellect and he has so many things to discuss and talk about the world. Especially the most general Basic things of life like flags and train. His immense knowledge on the world's history. It's like a fucking Wikipedia in front of me. You can have infinite discussion with him where you can agree to disagree. He talks about quantum theory and if you don't understand then he starts to talk about basic physics and its origin. I just wish I could just listen to him for some days.",,Character discussion,3,0.67,,False,True,4,bigbangtheory
Which of these commonly asked question annoys you the most when you see it asked again?,"

[View Poll](https://www.reddit.com/poll/138he5k)",,Repost,7,0.71,,False,True,8,bigbangtheory
Questions about Raj.,"Why was he always/almost always the one that sat on the floor?  Sometimes racism is brought up regarding his character since he is the only person of color in the group, but that does look like he is being put on a bottom rung.

Also, when his dad cut him off, why was he then basically homeless?  He went to work just like the rest of them and thus had a paycheck with which to pay bills like everyone else.  I suppose the answer could be that he had run up huge credit card bills he had to deal with since dad was no longer paying them, but that is speculation.  I don't think anything like that was ever specifically stated.",,Character discussion,4,0.67,,False,True,6,bigbangtheory
Can you name all of Leonard's women?,"I have to confess that as much as I absolutely love TBBT, I've always been a bit put off by how popular Leonard is with the ladies.  I was somewhat nerdy in my younger years, so maybe it's just jealousy, but I find it amazing how this science nerd is bedding down with, or being pursued by, one absolute babe after another.  Okay, they're not all gorgeous, but aside from Penny, most of them practically throw themselves at this guy that previously didn't know when he might have his next date, or something like that.

Penny, Pria, Alex (Sheldon's assistant), Stephanie the doctor, the girl at the comic book store.  The one on the ship on the North Sea voyage that he only made out with because he felt guilty.  Who else?  I'm sure I'm forgetting one or two (not counting Joyce Kim, the North Korean spy that had non-romantic reasons for being with him).",,Character discussion,0,0.4,,False,True,16,bigbangtheory
Ann shea looks like Bernadette and Amy had a baby,,,Cast news or sighting,127,0.95,,False,False,9,bigbangtheory
"While Sheldon Loves and adores Amy, who did he enjoy living with the most? Was is with Amy or Leonard and Penny?",,,Character discussion,98,0.95,,False,False,26,bigbangtheory
Happy May the 4th everyone ⭐️,,,Episode discussion,455,0.99,,False,False,12,bigbangtheory
Penny's last name,"First, I offer my apologies in advance if this topic has been discussed before. So, the other day I saw a Twitter thread that offered some curiousities about the series. 🤔 As a good fan, I knew almost all of them. But then I saw an image in which someone discovered that Penny maiden name, prior adopting the Hofstadter, is Teller. I understand the pun reference, but. Is this true? I missed that fact all this time! 😳  Have I failed as TBBT fan?",,Character discussion,91,0.81,,False,False,55,bigbangtheory
Happy star wars day here's one of my favorite clips with professor proton.,,,Video,31,0.91,,False,False,5,bigbangtheory
am not celebrating today… I’m waiting for Leonard’s day’,,,Episode discussion,98,0.97,,False,False,7,bigbangtheory
Rank The Seven Leads In Overall 'Knowledge',"I was rewatching the episode where Penny and Sheldon were quizzing each other to improve their respective knowledge and how Leonard was able to answer both questions easily and it got me thinking…

***If we try to rank all seven leads in terms of overall 'knowledge', how would rank them?***  

(Since everyone will define 'knowledge' differently, there is probably no right answer but I am trying to reward the different aspects of knowledge more than specializing in one specific area.  I am talking about book-smarts and street-smarts and relationship-smarts and career-smarts and family-smarts and cultural-smarts.)",,Character discussion,10,0.82,,False,True,17,bigbangtheory
BBT Wedding Theme??,https://www.instagram.com/reel/CrnxvqzPQZf/?igshid=YmMyMTA2M2Y=,,Repost,2,0.63,,False,True,0,bigbangtheory
What is this thing in Leonard and Sheldon’s apartment?,,,Other,162,0.98,,False,False,33,bigbangtheory
A cautionary tale,"As awesome as the series is and as much as we want other people to see how awesome it is, DON'T lend out your DVDs.

I was lending DVDs to my boss on a regular basis. She's keep them as long as she wanted and then return them to me still in working order. 

She saw that I had TBBT and her eyes got all big. She's been watching reruns on TV as her work schedule permitted but wasnt getting the full effect. I graciously offered to loan them to her. Seasons 1-6 and then 7-12. Well she watched and returned them and it wasn't until many months later l, when I was making a catalog of all my DVDs and Blu-ray, that I realized I was missing season 11.  

Now I'd moved on  from that job but still occasionally talked to my old boss. I mentioned it to her and she said she probably had it and would look. 6 months later I asked if she found it and she no she forgot to look, three months after that same story. About 3 weeks ago, over a year since she borrowed them, I contacted her again through a mutual friend because she had a new number. I asked nicely for her to find it or replace it and....no response.",,Other,3,0.64,,False,True,2,bigbangtheory
"(s11_ep21) raj takes credit for penny seeing the comet first, he justified it by saying he positioned the telescope, but you can clearly see penny adjusting the lens to clarify the actual picture...so after this, who takes proper credit?",,,Episode discussion,0,0.29,,False,True,15,bigbangtheory
Star Wars Day,"This whole time a part of me thought Star Wars Day was just a made up day by TBBT. But this promotional email proved me wrong lol. Anyway, happy Star Wars day to all those Star Wars fans.",,Storyline discussion,7,0.77,,False,False,0,bigbangtheory
"Maybe I’m just silly, but it kinda confused me…","…that Amy would help Barry Kripke make an advancement in string theory despite knowing how mean he was to Sheldon, especially after insisting Sheldon defend her against the (observably well-deserved) flack she was getting from Wil Wheaton. 

Am I the only one? What are you guys’ thoughts?",,Character discussion,0,0.44,,False,True,7,bigbangtheory
A real Italian treat! — Kraft mac and cheese with hot dogs,,,Other,14,0.8,,False,False,3,bigbangtheory
"Wait, Vince Gilligan has written Serial Ape-Ist 2 Monkey See, Monkey Kill?!",,,Other,287,0.99,,False,False,22,bigbangtheory
Originally misunderstood lyrics,"Okay so I just rewatched the episode where Raj and Howard make their band to play at Stuart’s store and they make the song about Thor and Indiana Jones.
On my rewatch i realized the lyrics are “Thor and Dr. Jones, Thor and Dr. Jones…”
Instead of “calling Dr. Jones…” anyone else make this mistake? I think it came from Raj’s accent when he first sings it. And yes, I knew the song was about Thor the first time I watched (that’s what the lightning and Loki parts are about) but I still thought the chorus was “calling Dr. Jones” lol",,Episode discussion,0,0.3,,False,True,6,bigbangtheory
What job reminds you of penny the most?,"What job reminds you of penny the most?

[View Poll](https://www.reddit.com/poll/137rhu8)",,Character discussion,1,0.67,,False,True,0,bigbangtheory
Edit of Young Sheldon,"I have a competition with my friend about who gets the most views, so please watch :)

[https://www.youtube.com/watch?v=Pu4yN6sFRtw](https://www.youtube.com/watch?v=Pu4yN6sFRtw)",,Young Sheldon,0,0.4,,False,True,0,bigbangtheory
Binged the whole series in three months. My thoughts,"Well that's it, three months ago I'd never even seen a single episode, now I've seen them all. Well here is a short list of what I liked and disliked about TBBT.

What I like: 
- loads of funny moments
- the characters (most of the time)
- tons of great episodes
- the chemistry between the cast
- the guest stars
- the acting
- the sad/serious moments are well done
- the side characters
- the character development
- the weddings

What I disliked/hated
- the last three or so seasons were pretty boring
- The way Sheldon treats everybody (especially Amy)
- Bernadette became so unlikeable near the end
- abandoned plots, like the air force project.
- continuity errors
- overusing the audience laughter
- some bad or boring episodes
- too much fighting and drama between the couples
- Raj not getting a ending

Overall I quite enjoyed Tbbt, and I give it a solid 8/10. Looking forward to see what the upcoming spin off has to offer.",,Other,81,0.9,,False,True,34,bigbangtheory
Which of the four guys do you think are the worst friend to the other guys? And which is the best?,"I always just thought Leonard was the best friend to the others but he also, stole a girl from Howard and was unnecessarily impatient and mean to Sheldon at time. Honestly it seems like Sheldon is surprisingly a more selfless friend to him than he is to Sheldon.",,Character discussion,0,0.47,,False,True,15,bigbangtheory
Why did Raj stop taking his father's money? Is he stupid?,,,Character discussion,71,0.76,,False,False,42,bigbangtheory
The weirdest thing in the entire series: S11E13,"In The Solo Oscillation, Penny stops by Sheldon's and together they work on string theory. I have to say no matter how many times I see that seen it just feels weird and wrong. Although Leonard and Amy's reaction was priceless.",,Episode discussion,1,0.54,,False,True,9,bigbangtheory
Did TBBT ever answer Mary Cooper's Question about how Howard and Bernadette will raise their kids: Jewish or Regular?,,,Character discussion,323,0.98,,False,False,60,bigbangtheory
Continuity error in Howard and Bernadette's timeline,"I know that the early parts of Howard and Bernadette's relationship is kind of fuzzy which is probably because she wasn't meant to be a permanent character. However what strikes me the most is the first time when they dated, she seemed like she wanted to have sex with Howard on the third date. However, later it is shown that she is kind of a prude (for my lack of thinking of a better word). For example, him and Bernadette going upto ""sixth base"" in Leonard's backseat. Sorry if my details are a bit fuzzy!",,Storyline discussion,7,0.73,,False,True,19,bigbangtheory
What are Raj’s best moments that shows his selective mutism?,"So I know that the title sounds bad, but my psychology class is doing a project on disorders and I chose Selective Mutism and it said we can use visuals, so I knew Raj would probably be my best bet, so I’m stuck on some of the moments with Missy in the first season, but didn’t know if there were any other examples I should look at.",,Character discussion,3,0.64,,False,True,25,bigbangtheory
What Possibly Could Missy Needed From Her Dad's Estate That Required Sheldon's Attention so many years after his death? One of those unanswered mysteries. The Shiksa Indeterminacy,,,Episode discussion,234,0.96,,False,False,24,bigbangtheory
