title,selftext,author_flair_text,link_flair_text,score,upvote_ratio,distinguished,is_original_content,is_self,num_comments,subreddit
Official Discord Server for r/bigbangtheory!,"Hi all!  
I made a The Big Bang Theory Discord and it has now became the official r/bigbangtheory discord!  
There is:

\- Weekly Rewatches

\- Trivia

\- A custom bot (that's in progress that will have lots of cool features!)

\- A friendly community  


Come join and say hi: [https://discord.gg/baDyeMjn3R](https://discord.gg/baDyeMjn3R)",pennyisafreeloader,,198,1.0,,False,True,17,bigbangtheory
New 'Big Bang Theory' Spinoff in Development at HBO Max from Chuck Lorre,,pennygetyourownwifi,,285,0.95,,False,False,142,bigbangtheory
I like President Siebert… 🥰,He knew how to manage his scientists.,,Character discussion,142,0.96,,False,False,18,bigbangtheory
Happy Flag Day,,,Episode discussion,75,1.0,,False,False,5,bigbangtheory
Can anyone teach me how to do this pls? Already wasted an hour on it...,,,meme,93,0.96,,False,False,6,bigbangtheory
I have sinned,,,meme,39,0.98,,False,False,5,bigbangtheory
Another Gamer Penny shot - because it's Halo night!,,,Character discussion,18,1.0,,False,False,2,bigbangtheory
I ate a butterfly! 😳,This is my favorite Howard quote. It cracks me up every time!,,Character discussion,78,0.97,,False,True,23,bigbangtheory
I just started the show after watching young Sheldon,"So I really loved young sheldon and he has become one of my comfort TV shows. So I was curious to watch the original. So far I’m loving it. I don’t know if this is a popular or unpopular opinion, but I see the YS characters and BBT characters synchronize each other perfectly. 
In season 1 when Mary appeared after sheldon was fired, despite the physical differences, I could see the YS Mary. 
So I don’t know whats the inverse impression.",,Young Sheldon,15,1.0,,False,True,14,bigbangtheory
Spherical Chickens in a Vacuum!,,,meme,20,0.99,,False,False,0,bigbangtheory
Favorite dialogue of Howard Wolowitz,,,Character discussion,8,1.0,,False,True,10,bigbangtheory
Favorite one liner of Sheldon,"My one was ""I'm not crazy my mother had me tested"" or ""physics is theoretical but the fun is real""",,Character discussion,150,0.99,,False,True,112,bigbangtheory
Roommate agreement,Write at least one in the comments and see how many we can get?,,Storyline discussion,42,0.92,,False,True,35,bigbangtheory
has anyone else cried bc of the show or am I just an absolute dork,"If so plz share which moments made you tear up!!! I need to know I’m not alone over here 😭

EDIT: since we’re all here crying together, here’s a video I came across this morning of the last table read for the final scene. Cried hard asf. https://youtu.be/BfUEwWqOVow

Big dork energy over here",,Storyline discussion,151,0.94,,False,True,109,bigbangtheory
"""I'm Batman shhh "" ~ Sheldon Cooper",I love this scenes,,meme,1,1.0,,False,False,0,bigbangtheory
"""I'm Batman shhh. "" ~ Sheldon Cooper",I love this scenes,,meme,1,1.0,,False,False,0,bigbangtheory
S3E22: Roomate agreement discussion. What if,"I think there was a huge opportunity for the show maker's to make it a little interesting (those 5-10 minutes).
When Sheldon and Leonard discuss inventing the time travel and decide meeting place would be that exact moment(5 seconds later). What if one of the atoms of the DNA structure of silicon based life form dropped on the floor, but when they turn back they see nothing and they dismiss it saying ""it might be due to wind"".",,Storyline discussion,22,0.87,,False,True,6,bigbangtheory
The Long Lost TBBT sequel you never knew you needed in your life,"&#x200B;

Hello everyone,

Fellow TBBT superfan here

Just wanted to say that I breathe TBBT and have watched SO many clips that I lost track of the number. So it made sense that a few months ago I got the idea to write a fanfic. Now it's out  and it would be great if you could check it out.

I'm really excited about my TBBT fanfic because I think it captures the spirit of the show and brings the characters to life in a way that I don't think has been done before. It's a story that really breathes new life into the show.

I am sure each one of you on this subreddit and reading this post wants to know SO BADD what the gang get up to in Pasadena. What I also know is that you want an alternate ending for Raj and you want to see Penny coping with her unexpected pregnancy

My fanfic will tackle al that and there is also a  cool Shamy arc and even COOLER Howie and Bernie arc.

I have linked the story below so would you kindly read the story and comment down below any thoughts or critique you have for me ( the more detailed the better) and  if u don't follow the A/N u will get spiders in ur bed!

link: [https://www.wattpad.com/story/342603942-tbbt-the-sequel-situation](https://www.wattpad.com/story/342603942-tbbt-the-sequel-situation)",,Other,0,0.5,,False,True,1,bigbangtheory
Best Ex-Relationship?,"

[View Poll](https://www.reddit.com/poll/148yvlt)",,Character discussion,2,1.0,,False,True,7,bigbangtheory
One of my favorite eps,S2 ep3,,Episode discussion,468,0.98,,False,False,58,bigbangtheory
"In the real world, which incidents would have gotten Sheldon punched?",,,Character discussion,6,0.69,,False,True,31,bigbangtheory
Is it just me or pennys hand is huge,I watch and whenever i see her hand i look at it and im like damn for a girl she is huge,,Character discussion,3,0.54,,False,True,18,bigbangtheory
Sheldon and Howard's Halloween costumes,"There's probably already a lot discussions on this begore but I cant really find them, so let's revisit it.

Was I the only one put off in the episode where Howard dresses up as Sheldon for Halloween, and Sheldon retaliated by doing the same but with Amy as Bernadette? Not by the costumes, rather the rest of the gang's reaction to it, especially Leonard.",,Episode discussion,21,0.93,,False,True,15,bigbangtheory
What’s up with these flags?,"I wouldn’t have noticed if I didn’t see my hometown flag, but they’re just hanging up in the library in S1E15. I don’t even know if the flag existed in 1989. Any meaning behind it, or just decoration?",,Young Sheldon,39,0.95,,False,False,13,bigbangtheory
“Where are you going with this Raj?”,https://youtu.be/qWgCEhQy8M8,,Video,9,0.77,,False,True,1,bigbangtheory
Raj Leonard Clip Request,"Can someone find me the clip with this dialouge:
Raj: “i havent had sex in a year”
Leonard: “raj, where are you going with this?”
Raj: “dude, don’t flatter yourself”",,Relevant to me,7,0.82,,False,True,1,bigbangtheory
So Penny has just broken up with Kurt before the pilot...,"She was 21 then. They were in a 4 year relationship. This means she was dating him at 17 and she said she started dating guys at 14. We know from the flashback with her high-school boyfriend that she was sexually active in 2003 so she was apparently having sex at 16. Having said that though, could she really have been with 31 men by early season 4 in late 2010? We assume she was faithful to Kurt in those 4 years so she had what 3 years in total to sleep with 31 guys from ages 16-17 and then 21-23. Sheldon says the maths doesn't lie but that's alot of partners in 3 years...anyone else got any theories of the real number?",,Character discussion,120,0.81,,False,True,153,bigbangtheory
What is your favourite joke about mrs Wolowitz,,,Character discussion,66,0.93,,False,True,91,bigbangtheory
I had to pause and make this because I can’t unsee the comparison,,,Character discussion,1049,0.96,,False,False,33,bigbangtheory
Who is your favorite secondary character?,For me it’s President Siebert. He’s just so theatrical and doesn’t care if he pisses the guys off.,,Character discussion,51,0.91,,False,True,74,bigbangtheory
Favorite Leonard one-liner?,"Mine is ""If he was easy to find the books would be called ""THERE'S WALDO""!!!!""",,Character discussion,209,0.98,,False,True,88,bigbangtheory
Anyone willing to make some fanfiction?,"I can’t believe I’m saying this but I kind of want to see a fanfic of young Sheldon the way it is now - but where George and Brenda did mess around. Also where Mary and Pastor Rob mess around. They keep teasing it in the show. I don’t want it to destroy the family or anything. I just want it to happen, they have a lot of stress and worry, mess around a few times, come clean, there’s some animosity and then they get back to normal. But still deal with Brenda and Pastor Rob. Bonus points if they get pregnant while cheating (both women are a little old for it but still plausible). I just want the bits of drama but still a feel good family thing in the end. I think I may make a sims game with these characters lol. (Yes I’m a dork, don’t hate, no harm meant)",,Young Sheldon,0,0.14,,False,True,5,bigbangtheory
"Do you skip any episodes on rewatch? If so, which episode and why?",,,Episode discussion,65,0.88,,False,True,181,bigbangtheory
🙌,,,Other,112,0.97,,False,False,3,bigbangtheory
Found this in my feed,Not my content,,Other,269,0.98,,False,False,21,bigbangtheory
Where is my daily battle of TBBT characters post? I’m salivating!,"Hope who ever has been posting them is okay, and doing well!",,Character discussion,2,0.56,,False,True,4,bigbangtheory
ages,might be a bit of a silly question but what ages are all the characters when they first appeared in the show and how old were they when it ended?,,Character discussion,23,0.9,,False,True,20,bigbangtheory
"Stephen Hawking wanted to ‘make black holes’ on Earth and it may not be impossible. Hopefully, CERN will have more luck raising the money than Sheldon did in The Monetary Insufficiency S11E22",,,Episode discussion,3,0.67,,False,False,1,bigbangtheory
What subreddits would Raj be in?,"&#x200B;

https://preview.redd.it/c8hiojt9mk5b1.png?width=194&format=png&auto=webp&v=enabled&s=203f05ebc3c47a65c8cbde27019b6ead440fce56",,Character discussion,5,0.86,,False,True,19,bigbangtheory
Episode where Sheldon looks hot? lol,"Hi guys,
Was wondering if you could help me with something lol. My friend and I are debating if Sheldon is ever “attractive” in the series (he def is), and I’m trying to find this one specific episode, but I’m unsure which one it is. It’s where Sheldon is in a suit and he greets Amy at her apartment, he’s sitting in a chair and he’s being all SeDuCtIvE and stuff lol. I remember he looks HAWT. Could someone please tell me which episode this is? I think this will be the evidence I need to prove her wrong.
Thanks guys! Hahaha :)",,Other,43,0.89,,False,True,36,bigbangtheory
Why did Will Wheaton suddenly just stop antagonising Sheldon?,,,Character discussion,81,0.93,,False,True,36,bigbangtheory
Spaghetti with Hot Dogs?,"Anyone ever tried? 
Jar sauce, I assume? Which?
Big dogs or weiners?
Do you not salt pasta water? (Because dogs are so salty. To me at least.)",,Young Sheldon,0,0.44,,False,True,13,bigbangtheory
"The joy is in the mystery, XD.",,,meme,436,0.99,,False,False,9,bigbangtheory
Battle of TBBT Characters - Round 8 - VOTE for your LEAST favorite at the link under the image! DR. GABLEHAUSER has been eliminated with 23.2% of the votes! NOTE: NO POSTS ON JUNE 12-14 to participate in the reddit boycott. We'll be back June 15.,"Vote at this link:
https://forms.gle/DFB6BsoXYJ8gmugbA

NOTE: NO POSTS ON JUNE 12-14 to participate in the reddit boycott. We'll be back June 15.

(Please only vote once per day. This is just for fun! Votes in comments below will not be counted, but feel free to discuss your favorites and least favorites!)

Dr. Gablehauser is out! He was in 2nd place the previous day. The vote is definitely getting more divided now that the clear least favorites are gone. Which favorites will remain in the end? Every character received at least 3 votes this round.

Character ratings: 
	24. Dr. Gablehauser
	25. Leslie Winkle
	26. Colonel Williams
	27. Beverly 
	28. Anu
	29. Priya
	30. Lucy

I'll post a poll each day for you to vote for your least favorite character. Each day the character with the most votes will be eliminated. We'll see which favorites remain until the end! Check tomorrow's post for today's poll results.

Note: I included characters based on their number of episodes listed on imdb, excluding Halley (since she was a baby/child and had no lines) and Stephen Hawking and Mike Massimino, who played themselves. I did include Wil Wheaton because it's been established that his character was a bit different than himself as a person.

The photo under Bernadette is Mrs. Wolowitz.

Names are purposely excluded from the pie chart so that tomorrow's results will be more of a surprise.",,Character discussion,85,0.9,,False,False,82,bigbangtheory
The sibling realignment was goergiejust a little too butt hurt about who his mom was most proud off,I watched young Sheldon as well. So that info colors my opinion as well. George became a teenage father did tons of dumb teenager shit.,,Episode discussion,0,0.27,,False,True,2,bigbangtheory
Just finished watching but…,"So I finally finished watching TBBT but the finally didn’t felt like a finally, it just felt like an ordinary 20 minute episode, (which it was) we saw the gang eat lunch all together one last while hearing a guitar them of the shows song and that was it. 

I mean I thought Rajesh would finally meet his soul mate, but he is still left behind like he was in the beginning of the show, and I really would have liked to see Leonard and Penny having there baby together but the show ended on a somewhat cliff hanger. 

Plus the show ended a year before Covid and would have been really hysterical seeing Sheldon reacting to it. 

Was there like a reason the show ended? 

Also I remember seeing a YouTube video in 2019 about the show ending, don’t remember much about but I remember it said was that the actor who played Sheldon, Jim Parsons was going to be payed like a million dollars for each episode of the final season?",,Spoiler,58,0.81,,False,True,64,bigbangtheory
Watching Young Sheldon for the first time! Thoughts so far.,"So I'm on Season 4 Ep 4 so far and I'm really liking it. The family is just so realistic, sometimes uncomfortably so. Notes:  


\-Everybody is so unnecessarily mean to Georgie! Despite what everyone says about him, he's actually pretty smart and responsible but his parents especially just don't give him any credit. He learned how to be a good salesman, got a job, bought the cable he wanted and bought himself a car all before being done high school, and even paid his boss his personal savings for the lost cash when he screwed up on his job. Nobody gives him any credit, stan georgie.

\-Missy is a girlboss, that's all. Shame it seems like she doesn't keep her wisecracks and streetsmarts as an adult (referring to her appearance in TBBT, though if I'm wrong about this forgive me, it's been a LONG time since I last saw TBBT)

\-Really genuinely shocked ol' meemaw didn't get back with Dr Sturgis, it really felt like they would get back together after the doctor was starting to feel regret. Don't care that much for the new dude but with how sitcoms usually go I feel like Dr Sturgis will get another chance.

\-Paige is a really interesting character and kind of sad so far, starts out as the young genius but gets more and more demoralized from where her smarts get her and is clearly suffering from what her family situation did to her. I hope things turn out well for her.

That's about it, gonna go watch more now.",,Young Sheldon,2,0.6,,False,True,6,bigbangtheory
Episode where Sheldon looks hot? lol,"Hi guys,
Was wondering if you could help me with something lol. My friend and I are debating if Sheldon is ever “attractive” in the series (he def is), and I’m trying to find this one specific episode, but I’m unsure which one it is. It’s where Sheldon is in a suit and he greets Amy at her apartment, he’s sitting in a chair and he’s being all SeDuCtIvE and stuff lol. I remember he looks HAWT. Could someone please tell me which episode this is? I think this will be the evidence I need to prove her wrong.
Thanks guys! Hahaha :)",,Other,3,0.66,,False,True,4,bigbangtheory
"Howard turtle necks, makes me laugh every time that they are just the turtle neck and not a full top",is there something in the show that also makes you laugh?,,Other,77,0.95,,False,True,16,bigbangtheory
"Where can I get Leonard's ringtone, like in S11: E1?","I just watched that episode and got the idea, I would like to have it as mine (Samsung). Hopefully I will get an answer.",,Other,2,0.75,,False,True,5,bigbangtheory
Two words: Young Raj,"This thought has persisted. Young Penny obviously. But Raj spoke often of his childhood, possibly more than anyone. His parents are awesome. We know his sister well. I think we know his family better than any other character.
And I think it could be culturally interesting. And funny.",,Character discussion,87,0.86,,False,True,63,bigbangtheory
Enough with the main character spin offs: Debbi Wolowitz spinoff,Yea I said it! I think a show about a recently single mom Debbie Wolowitz would be an amazing series. ,,Other,19,0.73,,False,True,16,bigbangtheory
this has been immediately annoying,,,Relevant to me,0,0.35,,False,False,4,bigbangtheory
Howard’s half brother has the most wasted character plot in the show.,Change my mind,,Character discussion,220,0.97,,False,True,50,bigbangtheory
Drawing of the Social Group (tell me what you think of it !),,,Other,272,0.96,,False,False,33,bigbangtheory
The gang decide to meet exactly 20 years from the present and only Stewart shows up. Is this canon? (S7E18),"At the end of the episode, after Raj's murder mystery game ends, the gang decide to meet in exactly 20 years for dinner. They all add it to their phone calendars. The scene cuts. 

It cuts a scene in the future. It shows the front of the apartment building which is their meeting spot. Stewart is the only one who shows up there - he's the only one to fulfil their pact 20 years earlier. 

Is this canon? Does this cutaway scene show the actual lore of this show in 20 years? If it does, it also shows something else. Futuristic, glowy smooth vehicles. I think this is quite silly for a 2 year prediction. It's a very cartoony presentation of future vehicles. 

So is this just a comedic cutaway? Many past and future scenes from shows are not necessarily canon, but some at least make this obvious. Here I'm a bit unsure. If it's canon, 1. That's shitty of everyone. 2. It's sad that it implies they're all too busy with their own individual lives. 3. Stewart was the only one to follow through, and he should be proud. This also implies they don't keep in contact with each other, or at least with Stewart. Otherwise they would have discussed it over messegss right? 4. Silly rediculous looking futuristic cars actually happen at least in this specific location (like their suburb). Who can say how such a shift in aesthetics occured. It's inconsistent with the world imo.

What do you think?",,Episode discussion,1,0.56,,False,True,8,bigbangtheory
Which subreddits would Howard be in?,"&#x200B;

https://preview.redd.it/mu04b5txne5b1.png?width=750&format=png&auto=webp&v=enabled&s=8d2349912e341249dc8db7840e9179a8b0851115",,Character discussion,1,0.57,,False,True,10,bigbangtheory
Best-looking food,"I've noticed that, particularly in the latter seasons, the food on the show looks so nice. I love how they all have a side salad with whatever the main course is, even pizza.

Other sitcoms like Friends, Cheers, and even Frasier mainly focus on beverages, so there's not really much the designers can play around with in terms of set dressing, but with this hang ordering takeout all the time and eating out, I appreciate the care they put into the way the food looks, even though most of them only pick at it.",,Other,10,0.8,,False,True,6,bigbangtheory
Battle of TBBT Characters - Round 7 - VOTE for your LEAST favorite at the link under the image! LESLIE WINKLE has been eliminated with 18.8% of the votes!,"Vote at this link:
https://forms.gle/unQL5gYqjpfStkCZ8

(Please only vote once per day. This is just for fun! Votes in comments below will not be counted, but feel free to discuss your favorites and least favorites!)

Leslie is out! She was in 2nd place the previous day, and in the top 5 on day 1, so I was surprised that the Colonel was eliminated first. The vote is definitely getting more divided now that the clear least favorites are gone. Which favorites will remain in the end? Every character received at least 4 votes this round as well, but the character with the fewest votes was different yet again - no consistent favorite has emerged yet!

Character ratings: 
	25. Leslie Winkle
	26. Colonel Williams
	27. Beverly 
	28. Anu
	29. Priya
	30. Lucy

I'll post a poll each day for you to vote for your least favorite character. Each day the character with the most votes will be eliminated. We'll see which favorites remain until the end! Check tomorrow's post for today's poll results.

Note: I included characters based on their number of episodes listed on imdb, excluding Halley (since she was a baby/child and had no lines) and Stephen Hawking and Mike Massimino, who played themselves. I did include Wil Wheaton because it's been established that his character was a bit different than himself as a person.

The photo under Bernadette is Mrs. Wolowitz.

Names are purposely excluded from the pie chart so that tomorrow's results will be more of a surprise.",,Character discussion,63,0.91,,False,False,58,bigbangtheory
What kind of father Would Sheldon be,As I saw in young Sheldon he talks about his kid. So I was wondering what kind of father Would Sheldon be,,Character discussion,45,0.89,,False,False,42,bigbangtheory
No muss no fuss not a single cuss,Times sheldon has hurt his friend's feelings,,Storyline discussion,84,1.0,,False,False,2,bigbangtheory
I would hate to have a best friend like Leonard.,"Poor Sheldon. I mean c’mon… I think from season 2 to the end of the series, Leonard only responds to Sheldon using sarcasm, insults, resentment, or criticism. I’m watching the episode where Leonard gives Sheldon and Amy a reused gift for their wedding. He probably laughed as he did it. Some friend. 

Would you like to have someone as a friend who was so critical of you? Make fun of you so much? Regularly guilt tripped you for being yourself, and was so overtly resentful doing anything to help you? 

The other characters are way more supportive and loving to one another. Curious to know your thoughts!",,Character discussion,0,0.19,,False,True,40,bigbangtheory
Sheldon and Penny Part 1,,,meme,113,0.96,,False,False,8,bigbangtheory
"Someone posted the other day about the difference between a bad person and a bad character, and I get it.","
Professor Proton is bad character, boring (the worst of all sins) and a downer in a show that is meant to be light, fun and funny. 

Bernadette went from being an okay character with potential (a funny mix of book smarts, with naïveté, with sweetness, with fierce loyalty to her partner) to a bad boring one (she was only mean with no other qualities). 

Prya was not likable, but she was supposed to be that way. We were supposed to love to hate her and I think she got that job done. That was a good character. 

Prya should have been there, Bernadette was an wasted opportunity. Prof. Proton is a waste of everybody’s time.",,Character discussion,0,0.3,,False,True,20,bigbangtheory
Did any of the main cast never sit in Sheldon's spot?,I just got to thinking about this and it's on my list for the next rewatch to watch for.,,Storyline discussion,75,0.95,,False,False,40,bigbangtheory
"What do you guys think about Alex Sheldon's assistant, I genuinely liked her character.",,,Character discussion,52,0.9,,False,True,23,bigbangtheory
How strange is all the Purell usage in the apartments when they could just wash their hands?,Just sayin,,Other,0,0.46,,False,True,13,bigbangtheory
Sheldon teaching Howard,Really wish they'd revisited this so Sheldon could have helped Howard get his PhD.,,Episode discussion,7,0.77,,False,True,6,bigbangtheory
Makes me laugh every single time I pass this on my way to work.,,,meme,3,0.64,,False,False,2,bigbangtheory
Which character do you think is the most 'normal' (I skipped Sheldon),"

[View Poll](https://www.reddit.com/poll/1464vvz)",,Character discussion,3,0.67,,False,True,3,bigbangtheory
Which bbt character do you relate to the most?,"For me I’d say it’s leanord. I have a similar mother to Beverly (by similar I mean just hard to get attention and affection from, Beverly is much worse lol) and I related to the insecurities leanord faces from his mom. I also think I would like to have Sheldon as a friend and roommate, not that he wouldn’t get on my nerves sometimes, it’s just that his personality is somehow comforting.",,Character discussion,5,0.74,,False,True,25,bigbangtheory
What’s your favorite Sheldon quotes/moments,,,Character discussion,67,0.95,,False,False,74,bigbangtheory
What are some adorable things Amy did in the show?,"I really hated Amy’s character when watching the show for the first time, but during my rewatches I’ve caught on to many adorable qualities in Amy. She really did compromise a lot in her relationship with Sheldon, but she still treated him very well, and was amazing towards everyone, despite her weirdness sometimes (especially at the beginning) but her entire personal growth was so cute.",,Character discussion,62,0.87,,False,True,39,bigbangtheory
Is this Amy Farrah Fowler on Law & Order S22E21 as an extra juror?,,,Cast news or sighting,15,0.64,,False,False,19,bigbangtheory
